{
  "schema_version": 1,
  "id": "part-cone-frustum-001",
  "description": "Revolve an XZ trapezoid around +Z to create an R10/R5, 20 mm cone frustum.",
  "length_unit": "metre",
  "angle_unit": "radian",
  "steps": [
    {
      "id": "create-document",
      "operation": "create_part",
      "parameters": {
        "configuration": "Default"
      }
    },
    {
      "id": "sketch-outer",
      "operation": "sketch_polygon",
      "parameters": {
        "plane": "XZ",
        "origin_m": [
          0,
          0,
          0
        ],
        "vertices_m": [
          [
            0,
            0
          ],
          [
            0.01,
            0
          ],
          [
            0.005,
            0.02
          ],
          [
            0,
            0.02
          ]
        ],
        "sketch_id": "main-profile"
      }
    },
    {
      "id": "revolve-profile",
      "operation": "revolve",
      "parameters": {
        "profiles": [
          "sketch-outer"
        ],
        "axis_origin_m": [
          0,
          0,
          0
        ],
        "axis_direction": [
          0,
          0,
          1
        ],
        "angle_rad": 6.283185307179586,
        "operation": "new_body"
      }
    }
  ],
  "analytic": {
    "shape": "cone_frustum",
    "dimensions_m": {
      "bottom_radius": 0.01,
      "top_radius": 0.005,
      "height": 0.02
    }
  }
}
